{
  "$comment": "SPDX-License-Identifier: CC-BY-4.0 · The Kelvara basin, a hypothetical semi-arid river basin. Generated by packages/engine-py/analysis/kelvara_basin.py: every value is a typical literature value or a labelled convention, and derived values are computed there. Not a model of any real place.",
  "schemaVersion": "3.0",
  "sources": {
    "lenses": "Blueprint v3.1 §6.1 example (enabled flags, plain names) and §1.4 (five classical lenses in v1.0)",
    "modules": "Blueprint v3.1 §1.4 (Modules 2–5 in v1.1, Module 6 in v1.2)",
    "parameters": "Model parameters not given here come from packages/scenarios/parameters.json (sourced registry)"
  },
  "id": "default-basin",
  "name": "Kelvara basin (hypothetical)",
  "provenance": {
    "kind": "example",
    "createdBy": "maintainer",
    "createdAt": "2026-10-05",
    "basedOn": null
  },
  "basin": {
    "inflow": {
      "wet": 22,
      "normal": 17,
      "dry": 12,
      "unit": "Mm3/season",
      "dryDrift": 0,
      "source": "Hypothetical Kelvara River. Wet and dry cards read as the 80th and 20th percentiles of seasonal flow, CV ≈ 0.35, typical of semi-arid steppe rivers (McMahon et al. 1987: annual-flow CV ≈ 0.43 outside Australia and southern Africa). Deck 1 wet / 3 normal / 2 dry is a teaching convention."
    },
    "deck": {
      "wet": 1,
      "normal": 3,
      "dry": 2
    },
    "reserve": {
      "value": 2,
      "mode": "absolute",
      "source": "About 12 % of mean flow: Tennant's 'minimum' (10 % of mean flow; Tennant 1976), below the 20–50 % of mean annual flow needed to keep a river in fair condition (Smakhtin et al. 2004). Stated openly in the game."
    },
    "aquifer": {
      "initial": 20,
      "capacity": 20,
      "reserve": 10.0,
      "lowThreshold": 15.0,
      "naturalRecharge": 1.0,
      "surplusRecharge": true,
      "returnFlows": true,
      "returnRecharge": 0.6,
      "gwSwCoupling": {
        "enabled": true,
        "maxInflowLossMm3": 1.0,
        "lossPerMm3BelowFull": 0.1
      },
      "seatCostMultipliers": [
        1.0,
        1.0,
        1.0
      ],
      "source": "Hypothetical shared alluvial aquifer of about 50 km² with specific yield about 0.10 (Johnson 1967), so 5 Mm³ of storage per metre of water-table change (ADR 0008). Full (20 Mm³) at 7 m depth; the low threshold, 15 Mm³, is 8 m, the suction limit of shallow pumps (Sekhri 2014); the reserve, 10 Mm³, is 9 m. Natural recharge 1 Mm³ per year ≈ 20 mm/yr, within the semi-arid range 0.2–35 mm/yr (Scanlon et al. 2006); a share of return flow recharges it too. One round is one irrigation year. Storage, depths and coupling are conventions."
    },
    "gameLength": {
      "min": 5,
      "max": 6
    },
    "orchardCrop": {
      "crop": "citrus",
      "depthMm": 1000,
      "beta": 0.9,
      "yieldTHa": 16.0,
      "ky": 0.95,
      "price": 1.71,
      "source": "Orchard switches a scheme to the basin's orchard crop, the citrus of the Upper Citrus Estate, at the scheme's own area and irrigation method; values and sources as for scheme A"
    }
  },
  "schemes": [
    {
      "id": "A",
      "name": "Upper Citrus Estate",
      "seat": 1,
      "shape": "circle",
      "glyph": "citrus",
      "crop": "citrus",
      "method": "drip",
      "actions": [
        "expand"
      ],
      "areaHa": 625,
      "depthMm": 1000,
      "beta": 0.9,
      "yieldTHa": 16.0,
      "ky": 0.95,
      "people": 634,
      "peopleUnit": "people",
      "kappa": 1.0,
      "price": 1.71,
      "derived": {
        "demandMm3": 6.25,
        "capacityT": 10000.0,
        "wpKgM3": 1.6
      },
      "privateGoal": {
        "kind": "livelihood_share",
        "threshold": 0.75
      },
      "fields": {
        "areaHa": {
          "source": "a commercial estate; estates of 300–1,500 ha are common (Kan et al. 2024)",
          "entered": "assumed",
          "outOfRange": false
        },
        "depthMm": {
          "source": "citrus ET 900–1,200 mm/yr (Doorenbos & Kassam 1979 (FAO-33)); gross at drip efficiency",
          "entered": "example",
          "outOfRange": false
        },
        "beta": {
          "source": "drip field application efficiency 90 % (Brouwer, Prins & Heibloem 1989 (FAO training manual 4), Annex 1 Table 8); 88–90 % (Jägermeyr et al. 2015, HESS 19:3073, Table 5)",
          "entered": "example",
          "outOfRange": false
        },
        "yieldTHa": {
          "source": "citrus world average ≈ 16 t/ha (Steduto et al. 2012 (FAO-66), citrus chapter)",
          "entered": "example",
          "outOfRange": false
        },
        "ky": {
          "source": "midpoint of the citrus range 0.8–1.1 (Doorenbos & Kassam 1979 (FAO-33))",
          "entered": "example",
          "outOfRange": false
        },
        "price": {
          "source": "fruit (oranges, apples) FAOSTAT producer prices 2019–2023, median of six semi-arid countries, relative to wheat; real ratios vary 1–4× by country",
          "entered": "example",
          "outOfRange": false
        },
        "kappa": {
          "source": "capability conversion factor κ = 1 (no conversion handicap assumed)",
          "entered": "assumed",
          "outOfRange": false
        },
        "people": {
          "source": "(households + FTE hired workers) × 5: one owner household; hired orchard labour: 28.5 worker-days/ha/yr plus harvest scaled from 37.6 days at 35.9 t/ha to 16 t/ha (Junta de Andalucía, Costes de producción de la naranja 2022/23), in Eurostat annual work units. = (1 + 125.7) × 5, a typical estimate",
          "entered": "derived",
          "outOfRange": false
        }
      },
      "pumpCostFactor": 1.0
    },
    {
      "id": "B",
      "name": "Midstream Paddy Cooperative",
      "seat": 2,
      "shape": "square",
      "glyph": "rice",
      "crop": "rice",
      "method": "flood",
      "actions": [
        "orchard",
        "expand"
      ],
      "areaHa": 900,
      "depthMm": 1000,
      "beta": 0.6,
      "yieldTHa": 5.0,
      "ky": 1.1,
      "people": 5225,
      "peopleUnit": "people",
      "kappa": 1.0,
      "price": 1.99,
      "derived": {
        "demandMm3": 9.0,
        "capacityT": 4500.0,
        "wpKgM3": 0.5
      },
      "privateGoal": {
        "kind": "adequacy_floor",
        "threshold": 0.5
      },
      "fields": {
        "areaHa": {
          "source": "smallholder paddy; most farms are under 2 ha (Lowder et al. 2016)",
          "entered": "assumed",
          "outOfRange": false
        },
        "depthMm": {
          "source": "irrigated rice input 400 to > 2,000 mm, low end for low-percolation soils (Steduto et al. 2012 (FAO-66))",
          "entered": "example",
          "outOfRange": false
        },
        "beta": {
          "source": "surface (basin) application efficiency 60 % (Brouwer, Prins & Heibloem 1989 (FAO training manual 4), Annex 1 Table 8); 42–62 % (Jägermeyr et al. 2015, HESS 19:3073, Table 5)",
          "entered": "example",
          "outOfRange": false
        },
        "yieldTHa": {
          "source": "irrigated lowland rice in Asia averages about 5 t/ha (Steduto et al. 2012 (FAO-66))",
          "entered": "example",
          "outOfRange": false
        },
        "ky": {
          "source": "no FAO seasonal Ky for flooded rice; assumed between wheat (1.05–1.15) and maize (1.25)",
          "entered": "assumed",
          "outOfRange": false
        },
        "price": {
          "source": "paddy rice FAOSTAT producer prices 2019–2023, median of six semi-arid countries, relative to wheat; real ratios vary 1–4× by country",
          "entered": "example",
          "outOfRange": false
        },
        "kappa": {
          "source": "capability conversion factor κ = 1 (no conversion handicap assumed)",
          "entered": "assumed",
          "outOfRange": false
        },
        "people": {
          "source": "(households + FTE hired workers) × 5: about 1 ha per household; 84 % of the world's farms are under 2 ha (Lowder et al. 2016); hired rice labour about 290 h/ha/season (median of 19 Indian states, 2017-18 to 2021-22, DES Cost of Cultivation; family labour is counted through households), one season a year, in Eurostat annual work units. = (900 + 145.0) × 5, a typical estimate",
          "entered": "derived",
          "outOfRange": false
        }
      },
      "pumpCostFactor": 1.8,
      "wellsFailAtOrBelow": 15.0
    },
    {
      "id": "C",
      "name": "Tail-end Wheat Farms",
      "seat": 3,
      "shape": "triangle",
      "glyph": "wheat",
      "crop": "wheat",
      "method": "sprinkler",
      "actions": [
        "orchard",
        "drip",
        "expand"
      ],
      "areaHa": 400,
      "depthMm": 850,
      "beta": 0.75,
      "yieldTHa": 5.0,
      "ky": 1.05,
      "people": 504,
      "peopleUnit": "people",
      "kappa": 1.0,
      "price": 1.0,
      "derived": {
        "demandMm3": 3.4,
        "capacityT": 2000.0,
        "wpKgM3": 0.59
      },
      "privateGoal": {
        "kind": "adequacy_in_half_seasons",
        "threshold": 0.8
      },
      "fields": {
        "areaHa": {
          "source": "about 80 family farms of about 5 ha",
          "entered": "assumed",
          "outOfRange": false
        },
        "depthMm": {
          "source": "wheat ETm 450–650 mm (Doorenbos & Kassam 1979 (FAO-33)); gross at sprinkler efficiency",
          "entered": "example",
          "outOfRange": false
        },
        "beta": {
          "source": "sprinkler application efficiency 75 % (Brouwer, Prins & Heibloem 1989 (FAO training manual 4), Annex 1 Table 8); 69–78 % (Jägermeyr et al. 2015, HESS 19:3073, Table 5)",
          "entered": "example",
          "outOfRange": false
        },
        "yieldTHa": {
          "source": "irrigated wheat 4–10 t/ha (Steduto et al. 2012 (FAO-66)); good commercial 6–9 t/ha (Doorenbos & Kassam 1979 (FAO-33))",
          "entered": "example",
          "outOfRange": false
        },